Publication Number,Title,Abstract,Claims
US10046660,"Devices, systems, and methods using reactive power injection for active tuning electric vehicle charging systems","Systems, methods, and apparatus are disclosed for wirelessly charging an electric vehicle. In one aspect, a method for transferring power via a magnetic field in a wireless power transfer system is provided. The method includes outputting an alternating electric current to a wireless power transmitter, generating, at the wireless power transmitter, the magnetic field in response to being driven with the alternating electrical current, receiving a value indicative of an electrical characteristic of the wireless power transmitter, and adjusting an operating characteristic of the wireless power transmitter to trigger a change in an electrical current in the receiver, the amount of adjustment selected to cause adjustment of an amount of reactive power in the wireless power transfer system based on changes in the receiver that automatically occur to maintain the output power substantially constant in response to the change in the electrical current in the receiver.","What is claimed is: 
1. An apparatus for wirelessly transferring power via a magnetic field in a wireless power transfer system, the system including a receiver having a resonant receive circuit configured to inductively couple power via the magnetic field, a power conversion circuit of the receiver configured to adjust an amount of reactive power in the wireless power transfer system to maintain an output power substantially constant in response to changes in the power received due to variations in coupling, the apparatus comprising: 
an inverter circuit configured to output alternating electrical current; 
a resonant transmit circuit comprising a coil electrically connected to a capacitive element, the resonant transmit circuit operably coupled to the inverter circuit and configured to generate the magnetic field in response to being driven with the alternating electrical current; and 
a controller configured to:  
receive a value indicative of an electrical characteristic of the inverter circuit; and 
adjust an operating characteristic of the inverter circuit to trigger a change in an electrical current in the receive circuit, the amount of adjustment of the operating characteristic of the inverter selected by the controller to cause adjustment of an amount of reactive power in the wireless power transfer system based on changes in the power conversion circuit that automatically occur to maintain the output power substantially constant in response to the change in the electrical current in the resonant receive circuit. 
2. The apparatus of claim 1, wherein the controller is further configured to determine the amount of reactive power in the wireless power transfer system based on the electrical characteristic of the inverter circuit and information regarding how the reactive power is adjusted at the receiver via the power conversion circuit based on the electrical characteristic of the inverter circuit.
3. The apparatus of claim 2, wherein the information regarding how the reactive power is adjusted at the receiver comprises a threshold limit for a duty cycle of a switching network associated with the power conversion circuit of the receiver.
4. The apparatus of claim 1, wherein the operating characteristic comprises a duty cycle of the inverter circuit.
5. The apparatus of claim 4, wherein the wherein the controller is further configured to reduce the duty cycle of the inverter circuit to reduce the electrical current in the receive circuit and to reduce the reactive power in the wireless power transfer system.
6. The apparatus of claim 1, wherein the electrical characteristic of the inverter circuit comprises a load angle of the inverter circuit.
7. The apparatus of claim 6, wherein the controller is further configured to determine the amount of reactive power in the wireless power transfer system based on a comparison of the load angle of the inverter circuit with a reference load angle.
8. The apparatus of claim 7, wherein the reference load angle is a pre-defined value or a value located in a look-up table.
9. The apparatus of claim 7, wherein the controller is further configured to adjust the load angle of the inverter circuit when the difference between the load angle of the inverter circuit and the reference load angle satisfies a threshold.
10. The apparatus of claim 6, wherein the load angle of the inverter circuit comprises an indication of a phase angle between a voltage and a current of the resonant transmit circuit.
11. The apparatus of claim 1, wherein the resonant transmit circuit is series-tuned.
12. The apparatus of claim 6, wherein the load angle comprises a difference between a time of a switching state change command of the inverter circuit and a time of a zero current crossing detection instant as detected by a current sensor.
13. The apparatus of claim 1, wherein the controller is further configured to adjust the operating characteristic of the inverter circuit based on a threshold limit for the alternating electrical current provided to the resonant transmit circuit.
14. The apparatus of claim 1, wherein the controller is further configured to adjust increase a voltage of the inverter circuit to increase the amount of reactive power in the wireless power transfer system.
15. A method for wirelessly transferring power via a magnetic field in a wireless power transfer system, the system including a receiver having a resonant receive circuit configured to inductively couple power via the magnetic field, a power conversion circuit of the receiver configured to adjust an amount of reactive power in the wireless power transfers system to maintain an output power substantially constant in response to changes in the power received due to variations in coupling, the method comprising: 
outputting an alternating electric current to a wireless power transmitter; 
generating, at the wireless power transmitter, the magnetic field in response to being driven with the alternating electrical current; and 
receiving a value indicative of an electrical characteristic of the wireless power transmitter; and 
adjusting an operating characteristic of the wireless power transmitter to trigger a change in an electrical current in the receiver, the amount of adjustment of the operating characteristic of the wireless power transmitter selected to cause adjustment of an amount of reactive power in the wireless power transfer system based on changes in the receiver that automatically occur to maintain the output power substantially constant in response to the change in the electrical current in the receiver. 
16. The method of claim 15, further comprising determining the amount of reactive power in the wireless power transfer system based on the electrical characteristic of the wireless power transmitter and information regarding how the reactive power is adjusted at the receiver based on the electrical characteristic of the wireless power transmitter.
17. The method of claim 16, wherein the information regarding how the reactive power is adjusted at the receiver comprises a threshold limit for a duty cycle of a switching network associated with the power conversion circuit of the receiver.
18. The method of claim 15, wherein the operating characteristic comprises a duty cycle of the wireless power transmitter.
19. The method of claim 18, further comprising reducing the duty cycle of the wireless power transmitter to reduce the electrical current in the receive circuit and to reduce the reactive power in the wireless power transfer system.
20. The method of claim 15, wherein the electrical characteristic of the wireless power transmitter comprises a load angle of an inverter circuit of the wireless power transmitter.
21. The method of claim 20, wherein the controller is further configured to determine the amount of reactive power in the wireless power system based on a comparison of the load angle of the inverter circuit with a reference load angle.
22. The method of claim 15, wherein the controller is further configured to adjust the operating characteristic of wireless power transmitter based on a threshold limit for the alternating electrical current provided to the wireless power transmitter.
23. The method of claim 15, wherein the controller is further configured to adjust increase a voltage of wireless power transmitter to increase the amount of reactive power in the wireless power transfer system.
24. An apparatus for wirelessly transferring power via a magnetic field in a wireless power transfer system, the system including a receiver having a resonant receive circuit configured to inductively couple power via the magnetic field, a power conversion circuit of the receiver configured to adjust an amount of reactive power in the wireless power transfers system to maintain an output power substantially constant in response to changes in the power received due to variations in coupling, the apparatus comprising: 
means for outputting an alternating electric current; 
means for generating the magnetic field in response to being driven with the alternating electrical current; and 
means for receiving a value indicative of an electrical characteristic of means for outputting the alternating electric current; and 
means for adjusting an operating characteristic of the means for outputting the alternating electric current to trigger a change in an electrical current in the receiver, the amount of adjustment of the operating characteristic of means for outputting the alternating electric current selected to cause adjustment of the amount of reactive power in the wireless power transfer system based on changes in the receiver that automatically occur to maintain the output power substantially constant in response to the change in the electrical current in the receiver. 
25. The apparatus of claim 24, further comprising means for determining an amount of reactive power in the wireless power transfer system based on the electrical characteristic of means for outputting the alternating electric current and information regarding how the reactive power is adjusted at the receiver based on the electrical characteristic of the means for outputting the alternating electric current.
26. The apparatus of claim 25, wherein the information regarding how the reactive power is adjusted at the receiver comprises a threshold limit for a duty cycle of a switching network associated with the power conversion circuit of the receiver.
27. A wireless power transfer system, comprising: 
a wireless power receiver comprising:  
a resonant receive circuit configured to inductively couple power via a magnetic field; 
a power conversion circuit having a switching network and configured to adjust an amount of reactive power in the wireless power transfers system in response to adjusting states of the switching network to maintain an output power substantially constant in response to changes in the power received due to variations in coupling; and 
a wireless power transmitter comprising:  
an inverter circuit configured to output alternating electrical current; 
a resonant transmit circuit comprising a coil electrically connected to a capacitive element, the resonant transmit circuit operably coupled to the inverter circuit and configured to generate the magnetic field in response to being driven with the alternating electrical current; and 
a controller configured to:  
receive a value indicative of an electrical characteristic of the inverter circuit; and 
adjust an operating characteristic of the inverter circuit to trigger a change in an electrical current in the receive circuit, the amount of adjustment of the operating characteristic of the inverter selected by the controller to cause adjustment of the amount of reactive power in the wireless power transfer system based on changes in the power conversion circuit that automatically occur to maintain the output power substantially constant in response to the change in the electrical current in the resonant receive circuit. 
28. The wireless power transfer system of claim 27, wherein the controller is further configured to determine the amount of reactive power in the wireless power transfer system based on the electrical characteristic of the inverter circuit and information regarding how the reactive power is adjusted at the receiver via the power conversion circuit based on the electrical characteristic of the inverter circuit.
29. The wireless power transfer system of claim 27, wherein the information regarding how the reactive power is adjusted at the receiver comprises a threshold limit for a duty cycle of the switching network.
30. The wireless power transfer system of claim 27, wherein the operating characteristic comprises a duty cycle of the inverter circuit."
US10083792,"System, method and apparatus for reducing the height of bipolar transmitters and/or receivers in electric vehicle charging","Systems, methods and apparatuses for reducing the height of bipolar transmitters and/or receivers in electric vehicle charging and/or power transfer are described herein. One implementation may include an apparatus for wireless power transfer. The apparatus comprises a ferromagnetic layer comprising at least one portion having a reduced thickness. The apparatus further comprises a first coil having at least one portion countersunk into the at least one portion of the ferromagnetic layer having the reduced thickness. The apparatus further comprises a second coil overlapping the at least one countersunk portion of the first coil. The at least one portion having the reduced thickness comprises a recess in the ferromagnetic layer. The ferromagnetic layer comprises a first plurality of ferromagnetic tiles having a first thickness and the at least one portion having the reduced thickness comprises a second plurality of ferromagnetic tiles having the reduced thickness.","What is claimed is: 
1. An apparatus for wireless power transfer, comprising: 
a ferromagnetic layer comprising at least one first portion having a first thickness and a plurality of second portions, each having a second thickness less than the first thickness; 
a first coil having a first section that rests on the at least one first portion, a plurality of second sections, each of which rests on one of the plurality of second portions of the ferromagnetic layer, and a third section that rests on the at least one first portion, the third section positioned between the plurality of second sections, the plurality of second sections of the first coil not coplanar with the first section, and the first coil configured to be driven with a first current; and 
a second coil overlapping the plurality of second sections of the first coil and configured to be driven with a second current different from the first current, 
the first and second coils configured to generate a magnetic field that is adjusted based on varying a magnitude or a phase of at least one of the first and second currents. 
2. The apparatus of claim 1, wherein each of the plurality of second portions comprises a recess in the ferromagnetic layer.
3. The apparatus of claim 1, wherein each of the plurality of second portions comprises a complete removal of the ferromagnetic layer.
4. The apparatus of claim 1, further comprising a shield layer having at least one portion recessed or removed that is substantially aligned with each of the plurality of second portions of the ferromagnetic layer.
5. The apparatus of claim 1, wherein the ferromagnetic layer comprises a first plurality of ferromagnetic tiles having the first thickness and a second plurality of ferromagnetic tiles having the second thickness that is less than the first thickness.
6. The apparatus of claim 1, wherein the ferromagnetic layer, the first coil and the second coil form a bipolar wireless power transmitter or receiver.
7. The apparatus of claim 1, wherein the first and second coils are configured to generate a magnetic flux for coupling to at least one receive coil.
8. The apparatus of claim 1, wherein any section of the first coil which does not rest on one of the plurality of second portions of the ferromagnetic layer is generally coplanar with the second coil.
9. The apparatus of claim 1, wherein the plurality of second sections of the first coil is offset below the first section by a distance equal to a thickness of the first coil.
10. The apparatus of claim 1, wherein the first coil additionally has the third section, the second coil overlapping the third section of the first coil.
11. A method for wireless power transfer, comprising: 
wirelessly transmitting or receiving power via a first coil having a first section that rests on a first portion of a ferromagnetic layer having a first thickness, a plurality of second sections, each of which rests on one of a plurality of second portions of the ferromagnetic layer having a second thickness less than the first thickness, and a third section that rests on the first portion, the third section positioned between two of the plurality of second sections, the first coil driven with a first current and the plurality of second sections not coplanar with the first section; and 
wirelessly transmitting or receiving power via a second coil overlapping the plurality of second sections of the first coil, the second coil driven with a second current different from the first current, 
the first and second coils generating a magnetic field that is adjusted based on varying a magnitude or a phase of at least one of the first and second currents. 
12. The method of claim 11, wherein each of the plurality of second portions comprises a recess in the ferromagnetic layer.
13. The method of claim 11, wherein each of the second portions comprises a complete removal of the ferromagnetic layer.
14. The method of claim 11, further comprising shielding an area from electromagnetic fields via a shield layer comprising at least one recessed or removed portion substantially aligned with the plurality of second portions of the ferromagnetic layer.
15. The method of claim 11, wherein the ferromagnetic layer comprises a first plurality of ferromagnetic tiles having the first thickness and a second plurality of ferromagnetic tiles having the second thickness that is less than the first thickness.
16. The method of claim 11, further comprising utilizing the first and second coils to generate a magnetic flux coupled to at least one receive coil.
17. The method of claim 11, wherein the first section of the first coil is generally coplanar with the second coil.
18. The method of claim 11, wherein each of the plurality of second sections of the first coil is offset below the first section of the first coil by a distance equal to a thickness of the first coil.
19. The method of claim 11, wherein the first coil additionally has the third section that rests on the plurality of second portions of the ferromagnetic layer, the second coil overlapping the third section of the first coil.
20. An apparatus for wireless power transfer, comprising: 
a ferromagnetic layer comprising at least one first portion having a first thickness and a plurality of second portions, each having a second thickness less than the first thickness, the at least one of the plurality of second portions having a portion in which the ferromagnetic layer is completely removed; 
a first coil having at least two first sections that each rests on one of the plurality of second portions, at least one of the first sections extending into a space of the at least one completely removed portion of the ferromagnetic layer, and a second section disposed between at least two of the plurality of first sections that rests on the at least one first portion, the first coil configured to be driven with a first current; and 
a second coil overlapping the plurality of first sections of the first coil and configured to be driven with a second current different from the first current, 
the first and second coils configured to generate a magnetic field that is adjusted based varying a magnitude or a phase of at least one of the first and second currents. 
21. The apparatus of claim 20, further comprising a shield layer having at least one portion recessed or removed that is substantially aligned with the completely removed portion of the ferromagnetic layer.
22. The apparatus of claim 20, wherein the ferromagnetic layer, the first coil and the second coil form a bipolar wireless power transmitter or receiver.
23. The apparatus of claim 20, wherein the first and second coils are configured to generate a magnetic flux for coupling to at least one receive coil.
24. A method for wireless power transfer, comprising: 
wirelessly transmitting or receiving power via a first coil having a plurality of first sections, at least one of which extends into an area of at least one completely removed portion of a ferromagnetic layer and a second section disposed between at least two of the plurality of first sections and resting on a first portion of the ferromagnetic layer having a larger thickness than the removed portion, the first coil configured to be driven with a first current; and 
wirelessly transmitting or receiving power via a second coil overlapping the at least two of the first sections of the first coil, the second coil configured to be driven with a second current different from the first current, 
the first and second coils generating a magnetic field structure that is adjusted based on varying a magnitude and a phase of at least one of the first and second currents. 
25. The method of claim 24, further comprising shielding an area from electromagnetic field via a shield layer comprising at least one recessed or removed portion substantially aligned with the at least one completely removed portion of the ferromagnetic layer.
26. The method of claim 24, further comprising utilizing the first and second coils to generate a magnetic flux coupled to at least one receive coil."
