Publication Number,Title,Abstract,Claims
US9472338,Wireless power transfer system coil arrangements and method of operation,"This disclosure provides systems, methods and apparatus for wireless power transfer and particularly wireless power transfer to remote systems such as electric vehicles. In one aspect the disclosure provides for an apparatus for wirelessly transmitting power. The apparatus includes a first conductive structure configured to generate a first magnetic field in response to receiving a first time-varying signal from a power source. The apparatus includes a second conductive structure configured to generate a second magnetic field in response to receiving a second time-varying signal from the power source. The first and second structures are positioned to maintain a substantial absence of mutual coupling between the first and second magnetic fields.","What is claimed is: 
1. An apparatus for wirelessly transmitting power, the apparatus comprising: 
a first conductive structure configured to generate a first magnetic field in response to receiving a first time-varying electrical current from a power source, the first conductive structure comprising a first loop and a second loop enclosing a first area and a second area, respectively, the first loop having a first surface and the second loop having a second surface that are substantially coplanar; and 
a second conductive structure configured to generate a second magnetic field in response to receiving a second time-varying electrical current from the power source, the second conductive structure comprising a third loop enclosing a third area, the first and second structures positioned to maintain a substantial absence of mutual coupling between the first and second conductive structures. 
2. The apparatus of claim 1, wherein the substantial absence of mutual coupling occurs at least in part when a net sum of the first magnetic field generated by the first conductive structure that intersects the second conductive structure is substantially zero.
3. The apparatus of claim 1, wherein the first conductive structure and the second conductive structure define an area in which the first and second magnetic fields at least partially overlap, and wherein the substantial absence of mutual coupling occurs at least in part when a collective effect of addition and subtraction of the first and second magnetic fields is substantially zero.
4. The apparatus of claim 1, wherein the first conductive structure and the second conductive structure are configured to wirelessly transmit power at a level sufficient to power or charge an electric vehicle via the first and second magnetic fields.
5. The apparatus of claim 1, wherein the third loop is positioned such that substantially a center of the third area is positioned substantially over a point between the first loop and the second loop.
6. The apparatus of claim 1, wherein the first and second loops comprise first and second coils, respectively, the first and second coils configured to be electrically connected to the power source, the power source configured to apply electric current to the first and second coils in the same direction in adjacent portions of the first and second coils.
7. The apparatus of claim 6, wherein the third loop 
comprises a third coil wound to enclose the third area. 
8. The apparatus of claim 1, wherein the first conductive structure has a substantially horizontally polarized magnetic moment, and wherein the second conductive structure has a substantially vertically polarized magnetic moment.
9. The apparatus of claim 1, wherein the first and second conductive structures are capacitively loaded and operable at a resonant frequency, wherein the resonant frequency is substantially equal to a resonant frequency of a third conductive structure configured to wirelessly receive power via the first and second magnetic fields.
10. The apparatus of claim 1, further comprising: 
a position detection circuit configured to identify a relative position of a third conductive structure relative to the first and second conductive structures; and 
a controller configured to control the first time-varying electrical current or the second time-varying electrical current based on the relative position. 
11. A method of wirelessly transmitting power, the method comprising: 
generating a first magnetic field via a first conductive structure in response to receiving a first time-varying electrical current from a power source, the first conductive structure comprising a first loop and a second loop enclosing a first area and a second area, respectively, the first loop having a first surface and the second loop having a second surface that are substantially coplanar; and 
generating a second magnetic field via a second conductive structure in response to receiving a second time-varying electrical current from the power source, the second conductive structure comprising a third loop enclosing a third area, the first and second structures positioned to maintain a substantial absence of mutual coupling between the first and second conductive structures. 
12. The method of claim 11, wherein the substantial absence of mutual coupling occurs at least in part when a net sum of the first magnetic field generated by the first conductive structure that intersects the second conductive structure is substantially zero.
13. The method of claim 11, wherein the first conductive structure and the second conductive structure define an area in which the first and second magnetic fields at least partially overlap, and wherein the substantial absence of mutual coupling occurs at least in part when a collective effect of addition and subtraction of the first and second magnetic fields is substantially zero.
14. The method of claim 11, wherein generating the first and second magnetic fields comprises generating the first and second magnetic fields at a level sufficient to wirelessly transfer power to power or charge an electric vehicle.
15. The method of claim 11, wherein the third loop is positioned such that substantially a center of the third area is positioned substantially over a point between the first loop and the second loop.
16. The method of claim 11, wherein the first and second loops comprise first and second coils, respectively, wherein the method further comprises applying electric current to the first and second coils in the same direction in adjacent portions of the first and second coils.
17. The method of claim 16, wherein the third loop comprises a third coil wound to enclose the third area.
18. The method of claim 11, wherein the first conductive structure has a substantially horizontally polarized magnetic moment, and wherein the second conductive structure has a substantially vertically polarized magnetic moment.
19. The method of claim 11, wherein the first and second conductive structures are capacitively loaded and operable at a resonant frequency, wherein the resonant frequency is substantially equal to a resonant frequency of a third conductive structure configured to wirelessly receive power via the first and second magnetic fields.
20. The method of claim 11, further comprising: 
identifying a relative position of a third conductive structure relative to the first and second conductive structures; and 
controlling the first time-varying electrical current or the second time-varying electrical current based on the relative position. 
21. An apparatus for wirelessly transmitting power, the apparatus comprising: 
a first means for generating a first magnetic field in response to receiving a first time-varying electrical current from a power source, the first generating means comprising a first loop and a second loop enclosing a first area and a second area, respectively, the first loop having a first surface and the second loop having a second surface that are substantially coplanar; and 
a second means for generating a second magnetic field in response to receiving a second time-varying electrical current from the power source, the second generating means comprising a third loop enclosing a third area, the first and second generating means positioned to maintain a substantial absence of mutual coupling between the first and second generating means. 
22. The apparatus of claim 21, wherein the substantial absence of mutual coupling occurs at least in part when a net sum of the first magnetic field generated by the first generating means that intersects the second generating means is substantially zero.
23. The apparatus of claim 21, wherein the first generating means and the second generating means define an area in which the first and second magnetic fields at least partially overlap, and wherein the substantial absence of mutual coupling occurs at least in part when a collective effect of addition and subtraction of the first and second magnetic fields is substantially zero.
24. The apparatus of claim 21, wherein the first generating means and the second generating means comprise means for wirelessly providing power at a level sufficient to power or charge an electric vehicle via the first and second magnetic fields.
25. The apparatus of claim 21, wherein the second generating means is positioned such that substantially a center of the third area is positioned substantially over a point between the first loop and the second loop.
26. The apparatus of claim 25, further comprising means for applying electric current to the first and second generating means in the same direction in adjacent portions of the first and second generating means.
27. The apparatus of claim 21, wherein the first generating means has a substantially horizontally polarized magnetic moment, and wherein the second generating means has a substantially vertically polarized magnetic moment.
28. The apparatus of claim 21, wherein the first and second generating means are capacitively loaded and operable at a resonant frequency, wherein the resonant frequency is substantially equal to a resonant frequency of a conductive structure configured to wirelessly receive power via the first and second magnetic fields."
US9505314,"Systems, methods, and apparatus related to detecting and identifying electric vehicle and charging station","Systems, methods, and apparatus are disclosed for communicating between a charging station and an electric vehicle. In one aspect, a method of pairing a charging station with an electric vehicle is provided, including providing wireless power via a magnetic field having a first intensity level that is sufficient to charge or power the electric vehicle, providing an information signal via the magnetic field when the magnetic field is set at a second intensity level that is lower than the first intensity level, the information signal uniquely identifying the charging station from a plurality of charging stations, communicating with the electric vehicle via a communication link that is different from the magnetic field, communicating comprising communicating with the electric vehicle parking guidance information to the location of the charging station, and establishing the communication link based at least in part on the information signal provided via the magnetic field.","What is claimed is: 
1. An apparatus for providing wireless power, comprising: 
a transmitter comprising one or more coils configured to provide wireless power via a magnetic field having a first intensity level that is sufficient to charge or power an electric vehicle, the one or more coils further configured to provide an information signal via the magnetic field when the magnetic field is set at a second intensity level that is lower than the first intensity level, the information signal having one or more characteristics that uniquely identify the transmitter from a plurality of transmitters; and 
a transceiver connected to the transmitter and configured to:  
communicate with the electric vehicle via a communication link that is different from the magnetic field; and 
establish the communication link with the electric vehicle based at least in part on the information signal provided via the magnetic field, the transmitter further configured to communicate with the electric vehicle, via the communication link, parking guidance information to the location of the one or more coils. 
2. The apparatus of claim 1, wherein establishing the communication link comprises establishing the communication link before a portion of one or more coils of the electric vehicle are positioned over the one or more coils of the transmitter.
3. The apparatus of claim 1, wherein the one or more coils comprises a first coil configured to provide wireless power to the electric vehicle via the magnetic field at the first intensity level and a second coil configured to provide the information signal via the magnetic field at the second intensity level.
4. The apparatus of claim 1, wherein the transmitter is further configured to provide wireless power at a first frequency and provide the information signal at a second frequency, the second frequency different from the first frequency.
5. The apparatus of claim 1, wherein the second intensity level is of sufficient power to be received by the electric vehicle at least within a portion of an area defining a parking space.
6. The apparatus of claim 1, wherein the transmitter is further configured to provide the information signal at a frequency different from a frequency of another information signal provided via another magnetic field from at least one other transmitter of the plurality of transmitters.
7. The apparatus of claim 1, wherein the transceiver is further configured to: 
transmit and receive information related to the wireless power provided between the transmitter and the electric vehicle; and 
establish the communication link based at least in part on information identifying the electric vehicle, or information regarding the wireless power provided between the transmitter and the electric vehicle, provided or received by the transceiver. 
8. The apparatus of claim 1, wherein the transmitter alternates or modulates the magnetic field to generate the information signal.
9. The apparatus of claim 1, wherein the transceiver is further configured to receive approach information indicating the electric vehicle is approaching the location of the one or more coils, and wherein the transmitter is configured to provide the information signal in response to the transceiver receiving the approach information.
10. The apparatus of claim 1, further comprising a receiver configured to: 
receive an information signal from each of a plurality of electric vehicles, each information signal received via a different magnetic field; 
determine a position or direction of each electric vehicle of the plurality of electric vehicles based on the information signal; and 
select an electric vehicle for wireless charging that has a position closest to the one or more coils. 
11. The apparatus of claim 1, further comprising a receiver configured to: 
receive a second information signal via a second magnetic field from the electric vehicle, wherein the second information signal uniquely identifies the electric vehicle from a plurality of electric vehicles; and 
establish the communication link with the electric vehicle based at least in part on the second information signal received from the electric vehicle. 
12. The apparatus of claim 11, wherein the receiver receives the second information signal at a frequency different from a frequency of another information signal the transceiver receives via another magnetic field from at least one other electric vehicle of the plurality of electric vehicles.
13. An apparatus for receiving wireless power, comprising: 
a receiver comprising one or more coils configured to receive wireless power from a charging station via a magnetic field having a first intensity level that is sufficient to charge or power a battery, the one or more coils further configured to provide an information signal via the magnetic field when the magnetic field is set at a second intensity level that is lower than the first intensity level, the information signal having one or more characteristics that uniquely identify the receiver from a plurality of receivers; and 
a transceiver connected to the receiver and configured to:  
communicate with the charging station via a communication link that is different from the magnetic field; and 
establish the communication link with the charging station based at least in part on the information signal provided via the magnetic field, wherein the receiver is further configured to communicate with the charging station, via the communication link, parking guidance information to the location of the one or more coils. 
14. The apparatus of claim 13, wherein the one or more coils comprises a first coil configured to receive wireless power from the charging station via the magnetic field at the first intensity level and a second coil configured to provide the information signal via the magnetic field at the second intensity level.
15. The apparatus of claim 13, wherein the receiver is further configured to receive wireless power at a first frequency and provide the information signal at a second frequency, the second frequency different from the first frequency.
16. The apparatus of claim 13, wherein the receiver is further configured to provide the information signal at a frequency different from a frequency of another information signal provided via another magnetic field from at least one other receiver of the plurality of receivers.
17. The apparatus of claim 13, wherein the transceiver is further configured to receive approach information indicating the one or more coils is approaching the location of the charging station, and wherein the receiver is configured to provide the information signal in response to the transceiver receiving the approach information.
18. The apparatus of claim 13, wherein the receiver is further configured to: 
receive an information signal from each of a plurality of charging stations, each information signal received via a different magnetic field; 
determine a position or direction of each charging station of the plurality of charging stations based on the information signal; and 
select a charging station for wireless charging that has a position closest to the one or more coils. 
19. The apparatus of claim 13, wherein the receiver is further configured to: 
receive a second information signal via a second magnetic field from the charging station, wherein the second information signal uniquely identifies the charging station from a plurality of charging stations; and 
establish the communication link with the charging station based at least in part on the second information signal received from the charging station. 
20. The apparatus of claim 19, wherein the receiver receives the second information signal at a frequency different from a frequency of another information signal the transceiver receives via another magnetic field from at least one other charging station of the plurality of charging stations.
21. A method of pairing a charging station with an electric vehicle, comprising: 
providing wireless power via a magnetic field having a first intensity level that is sufficient to charge or power the electric vehicle; 
providing an information signal via the magnetic field when the magnetic field is set at a second intensity level that is lower than the first intensity level, the information signal having one or more characteristics that uniquely identify the charging station from a plurality of charging stations; 
communicating with the electric vehicle via a communication link that is different from the magnetic field, communicating via the communication link comprising communicating with the electric vehicle parking guidance information to the location of the charging station; and 
establishing the communication link with the electric vehicle based at least in part on the information signal provided via the magnetic field. 
22. The method of claim 21, wherein providing wireless power comprises providing wireless power at a first frequency, and providing an information signal comprises providing an information signal at a second frequency, the second frequency different from the first frequency.
23. The method of claim 21, wherein providing an information signal comprises providing an information signal at a frequency different from a frequency of another information signal provided via another magnetic field from at least one other charging station of the plurality of charging stations.
24. The method of claim 21, further comprising receiving approach information indicating the electric vehicle is approaching the location of the charging station, and wherein providing an information signal comprises providing an information signal in response to the transceiver receiving the approach information.
25. The method of claim 21, further comprising receiving a second information signal via a second magnetic field from the electric vehicle, wherein the second information signal uniquely identifies the electric vehicle from a plurality of electric vehicles; and 
wherein establishing the communication link comprises establishing the communication link with the electric vehicle based at least in part on the second information signal received from the electric vehicle. 
26. The method of claim 25, wherein receiving a second information signal comprises receiving a second information signal at a frequency different from a frequency of another information signal received via another magnetic field from at least one other electric vehicle of the plurality of electric vehicles.
27. An apparatus for providing wireless power, comprising: 
means for providing wireless power via a magnetic field having a first intensity level that is sufficient to charge or power an electric vehicle, the providing means further configured to provide an information signal via the magnetic field when the magnetic field is set at a second intensity level that is lower than the first intensity level, the information signal having one or more characteristics that uniquely identify the providing means from a plurality of providing means; and 
means for communicating with the electric vehicle via a communication link that is different from the magnetic field, the communicating means configured to communicate with the electric vehicle, via the communication link, parking guidance information to the location of the charging station; and 
means for establishing the communication link with the electric vehicle based at least in part on the information signal provided via the magnetic field. 
28. The apparatus of claim 27, wherein the providing means comprises a transmitter, wherein the communication means, transmitting and receiving means, and the establishing means comprise a transceiver.
29. The apparatus of claim 27, wherein the providing means is further configured to provide wireless power at a first frequency and provide the information signal at a second frequency, the second frequency different from the first frequency.
30. The apparatus of claim 27, wherein the providing means is further configured to provide the information signal at a frequency different from a frequency of an information signal provided via a magnetic field from at least one charging station of the plurality of charging stations."
