Publication Number,Title,Abstract,Claims
US10063110,Foreign object detection in wireless energy transfer systems,"The disclosure features wireless energy transfer systems that include a plurality of sensors coupled to a controller, wherein the controller is configured to: obtain a system calibration state including a set of basis vectors derived from a first set of electrical signals generated by the plurality of sensors with no foreign object debris in proximity to the system; measure a second set of electrical signals from the sensors; calculate a projection of the second set of electrical signals onto the set of basis vectors; calculate a detection signal based on the projection; determine whether foreign object debris is present in proximity to the system by comparing the calculated detection signal to a detection threshold value; and adjust the system calibration state based on the presence or absence of foreign object debris in proximity to the system to generate an updated system calibration state.","What is claimed is: 
1. A wireless energy transfer system, comprising: 
a source resonator configured to generate an oscillating magnetic field to transfer energy to a receiver resonator; 
a plurality of sensors, wherein each of the sensors is configured to generate an electrical signal in response to a magnetic field; and 
a controller coupled to each of the sensors, 
wherein during operation of the system, the controller is configured to:  
obtain a system calibration state comprising a set of basis vectors derived from a first set of electrical signals generated by the plurality of sensors with no foreign object debris in proximity to the system; 
measure a second set of electrical signals generated by the plurality of sensors; 
calculate a projection of the second set of electrical signals onto the set of basis vectors; 
calculate a detection signal based on the projection of the second set of electrical signals; 
determine whether foreign object debris is present in proximity to the system by comparing the calculated detection signal to a detection threshold value; and 
adjust the system calibration state based on the presence or absence of foreign object debris in proximity to the system to generate an updated system calibration state. 
2. The system of claim 1, wherein the controller is configured to obtain the system calibration state by: 
determining an inverse covariance matrix for the first set of electrical signals; and 
determining the set of basis vectors by determining a set of eigenvectors of the inverse covariance matrix. 
3. The system of claim 2, wherein the controller is configured to determine the inverse covariance matrix based on mean-subtracted values derived from the first set of electrical signals.
4. The system of claim 3, wherein values comprise at least one of amplitudes of the first set of electrical signals and phases of the first set of electrical signals.
5. The system of claim 1, wherein the plurality of sensors comprises n sensors, and wherein each of the basis vectors comprises n elements.
6. The system of claim 5, wherein for each basis vector, each of the n elements corresponds to a contribution from a different one of the n sensors.
7. The system of claim 5, wherein the projection comprises a vector of length p<n, and wherein each element of the projection corresponds to a contribution of a different one of the basis vectors to a representation of the second set of electrical signals.
8. The system of claim 7, wherein the controller is configured to calculate the detection signal as a norm of the projection.
9. The system of claim 7, wherein the controller is configured to calculate the detection signal as a scaled norm of the projection in which each element of the projection is scaled according an eigenvalue associated with a corresponding one of the basis vectors.
10. The system of claim 2, wherein the controller is configured to adjust the system calibration state when foreign object debris is not in proximity to the system.
11. The system of claim 10, wherein the controller is configured to adjust the system calibration state by generating an updated inverse covariance matrix based on the second set of electrical signals.
12. The system of claim 11, wherein the controller is configured to generate the updated inverse covariance matrix using an infinite impulse response filter.
13. The system of claim 1, wherein prior to obtaining the system calibration state, the controller is configured to determine whether foreign object debris is present in proximity to the system.
14. The system of claim 13, wherein the controller is configured to determine whether foreign object debris is present in proximity to the system prior to obtaining the system calibration state by: 
measuring a plurality of sets of electrical signals generated by the plurality of sensors, wherein each set of electrical signals corresponds to a different relative position of the source and receiver resonators; 
generating a position covariance matrix based on the plurality of sets of electrical signals; 
determining a set of position basis vectors corresponding to eigenvectors of an inverse of the position covariance matrix; 
measuring a third set of electrical signals generated by the plurality of sensors; 
calculating a projection of the third set of electrical signals onto the set of position basis vectors; and 
determining whether foreign object debris is present in proximity to the system based on a magnitude of the projection of the third set of electrical signals. 
15. The system of claim 14, wherein the set of position basis vectors corresponds to a set of m eigenvectors of the inverse of the position covariance matrix that correspond to m largest eigenvalues of the inverse of the position covariance matrix.
16. The system of claim 1, wherein obtaining the system calibration state comprises retrieving the system calibration state from an electronic storage medium.
17. The system of claim 1, wherein obtaining the system calibration state comprises: 
determining an inverse covariance matrix for the first set of electrical signals; 
determining a set of eigenvectors of the inverse covariance matrix; and 
determining the set of basis vectors from the eigenvectors of the inverse covariance matrix. 
18. A method, comprising: 
determining a system calibration state comprising an inverse covariance matrix for a first set of electrical signals generated by a plurality of sensors in proximity to a wireless energy transfer system when no foreign object debris is in proximity to the wireless energy transfer system; 
determining a set of basis vectors from eigenvectors of the inverse covariance matrix; 
measuring a second set of electrical signals generated by the plurality of sensors; 
calculating a detection signal based on a projection of the second set of electrical signals onto the set of basis vectors; 
determining whether foreign object debris is present in proximity to the wireless energy transfer system by comparing the calculated detection signal to a detection threshold value; and 
adjusting the system calibration state based on the presence or absence of foreign object debris in proximity to the system to generate an updated system calibration state. 
19. The method of claim 18, further comprising determining the inverse covariance matrix based on values derived from the first set of electrical signals, wherein the values comprise at least one of amplitudes of the first set of electrical signals and phases of the first set of electrical signals.
20. The method of claim 18, wherein: 
the plurality of sensors comprises n sensors; 
each of the basis vectors comprises n elements each corresponding to a contribution from a different one of the n sensors; 
the projection comprises a vector of length p<n; 
each element of the projection corresponds to a contribution of a different one of the basis vectors to a representation of the second set of electrical signals."
US10158251,Wireless energy transfer for rechargeable batteries,A wireless energy transfer enabled battery includes a resonator that is positioned asymmetrically in a battery sized enclosure such that when two wirelessly enabled batteries are placed in close proximity the resonators of the two batteries have low coupling.,"What is claimed is: 
1. A device capable of being charged wirelessly, the device comprising: 
a cylindrical enclosure, symmetrical around an axis, comprising a first end having a positive terminal and a second end having a negative terminal and having a form factor corresponding to a battery; and 
a magnetic resonator disposed within the cylindrical enclosure, the magnetic resonator comprising a plurality of loops of a conductive material oriented coaxially with the axis of the cylindrical enclosure, the plurality of loops coupled to at least one capacitor and coupled to the positive terminal and the negative terminal, 
wherein the magnetic resonator is configured to receive energy wirelessly through an oscillating magnetic field generated by a source magnetic resonator with a source resonant frequency; 
wherein the magnetic resonator has an unperturbed resonant frequency that is different than the source resonant frequency; and 
wherein the device is a first device, and is configured so that when a second device enclosed within a second enclosure and comprising a second magnetic resonator is positioned proximate to the cylindrical enclosure such that the first device and the second device are not directly electrically connected, the magnetic resonator has a perturbed resonant frequency that matches the source resonant frequency. 
2. The device of claim 1, wherein the at least one capacitor comprises a variable capacitor, and wherein the variable capacitor adjusts the perturbed resonant frequency to a value that is closer to the source resonant frequency than a value of the perturbed resonant frequency in absence of the at least one capacitor.
3. The device of claim 1, further comprising a variable inductor disposed within the cylindrical enclosure and coupled to the plurality of loops, wherein the variable inductor adjusts the perturbed resonant frequency to a value that is closer to the source resonant frequency than a value of the perturbed resonant frequency in absence of the variable inductor.
4. The device of claim 1, further comprising: 
a variable inductor disposed within the cylindrical enclosure and coupled to the plurality of loops, 
wherein the at least one capacitor comprises a variable capacitor; and 
wherein the variable inductor and the variable capacitor adjust the perturbed resonant frequency to a value that is closer to the source resonant frequency than a value of the perturbed resonant frequency in absence of the variable inductor and the variable capacitor. 
5. An apparatus, comprising: 
The device of  claim 1, wherein the device is a first device;
a second device enclosed within a second enclosure and comprising a second magnetic resonator, 
wherein the second device is positioned relative to the first device such that the first and second devices are separated by a distance d, their respective symmetry axes are parallel, and the positive terminal of the first device is proximate to a negative terminal of the second device; and 
wherein a value of a coupling parameter k between the first and second devices is less than 20% of a maximum possible value of k for any orientation of the first and second devices at the distance d. 
6. The apparatus of claim 5, wherein the value of k is less than 10% of the maximum possible value of k for any orientation of the first and second devices at the distance d.
7. The device of claim 1, wherein the unperturbed resonant frequency is lower than the source resonant frequency by an amount equal to a frequency perturbation of the magnetic resonator caused by the second device.
8. The device of claim 1, wherein the magnetic resonator has a quality factor of at least 100.
9. The device of claim 1, wherein the cylindrical enclosure has a form factor that corresponds to a AA sized battery.
10. The device of claim 1, wherein the cylindrical enclosure has a form factor that corresponds to a AAA sized battery.
11. The device of claim 1, wherein the cylindrical enclosure has a form factor that corresponds to a D sized battery.
12. The device of claim 1, wherein the plurality of loops of the conductive material are formed on a flexible substrate.
13. The device of claim 1, further comprising a magnetic material around which the plurality of loops is wound.
14. The device of claim 1, further comprising: 
an energy storage cell disposed within the cylindrical enclosure, 
wherein the energy storage cell is coupled to the magnetic resonator to store energy received by the magnetic resonator; and 
wherein the energy storage cell is coupled to the positive terminal and to the negative terminal of the cylindrical enclosure. 
15. The device of claim 14, further comprising a magnetic material disposed on a surface of the energy storage cell, wherein the plurality of loops of the conductive material are wound around the magnetic material.
16. The device of claim 14, wherein the energy storage cell is a rechargeable cell and is configured to receive charging energy from the magnetic resonator during charging of the device, and to discharge energy through the positive and negative terminals when the device is not being charged.
17. The device of claim 1, wherein the magnetic resonator is positioned closer to the second end of the cylindrical enclosure than to the first end of the cylindrical enclosure."
US10211681,Foreign object detection in wireless energy transfer systems,"The disclosure features apparatus, methods, and systems for wireless power transfer that include a power source featuring at least one resonator, a power receiver featuring at least one resonator, a first detector featuring one or more loops of conductive material and configured to generate an electrical signal based on a magnetic field between the power source and the power receiver, a second detector featuring conductive material, and control electronics coupled to the first and second detectors, where during operation, the control electronics are configured to measure the electrical signal of the first detector and compare the measured electrical signal of the first detector to baseline electrical information for the first detector to determine information about whether debris is positioned between the power source and the power receiver.","What is claimed is: 
1. A wireless power transfer system, comprising: 
an auxiliary coil positioned in proximity to at least one of a power source and a power receiver; 
a detector positioned in proximity to at least one of the power source and the power receiver, wherein the detector is configured to generate an electrical signal in response to a change in a magnetic field; and 
control electronics coupled to the auxiliary coil and to the detector, wherein the control electronics are configured to:  
activate at least one of the power source and the auxiliary coil to generate a magnetic field at a position of the detector; 
measure the electrical signal generated by the detector in response to the magnetic field; and 
determine whether debris is positioned in proximity to at least one of the power source and the power receiver by comparing baseline information to the measured electrical signal, 
wherein the baseline information comprises information about an electrical signal generated by the detector when no debris is positioned in proximity to the power source and the power receiver; and 
wherein the control electronics are configured to compare the baseline information to the measured signal by determining mean and covariance matrices for the baseline information and determining whether debris is positioned in proximity to at least one of the power source and the power receiver based on the mean and covariance matrices. 
2. The system of claim 1, wherein the control electronics are configured to calculate a likelihood value that debris is positioned in proximity to at least one of the power source and the power receiver based on the mean and covariance matrices.
3. The system of claim 2, wherein the control electronics are configured to calculate a probability value between 0 and 1 that debris is positioned in proximity to at least one of the power source and the power receiver, based on the likelihood value.
4. The system of claim 2, wherein the control electronics are configured to determine whether debris is positioned in proximity to at least one of the power source and the power receiver by comparing the likelihood value to a threshold likelihood value.
5. The system of claim 1, wherein the control electronics are configured to obtain the baseline information by: 
retrieving the information from an electronic storage unit; or 
activating at least one of the power source and the auxiliary coil to generate a magnetic field at a position of the detector with no debris in proximity to the power source and the power receiver to generate a magnetic flux at the detector, and measuring the electrical signal generated by the detector in response to the magnetic flux. 
6. The system of claim 5, wherein the control electronics are configured to activate the power source and to measure the electrical signal of the detector without power transfer occurring between the power source and the power receiver.
7. The system of claim 6, wherein the baseline information comprises information about electrical signals generated by the detector that correspond to different operating states of the system, and wherein the different operating states correspond to at least one of different energy transfer rates between the power source and the power receiver, different alignments between the power source and the power receiver, and different spacings between the power source and the power receiver measured along a direction orthogonal to a plane defined by the auxiliary coil.
8. The system of claim 7, wherein the control electronics are configured to generate mean and covariance matrices that correspond to each of the different operating states, and to compare the measured signal to a portion of the baseline information that corresponds to the operating state of the system.
9. The system of claim 8, wherein the control electronics are configured to determine the operating state of the system by comparing the measured electrical signal of the detector to the mean and covariance matrices corresponding to each of the different operating states.
10. The system of claim 1, wherein the power source is a component of a vehicle charging station, and the power receiver is a component of a vehicle.
11. The system of claim 1, wherein the auxiliary coil comprises one or more loops of conductive material arranged to form a planar coil defining a first plane, and wherein the detector comprises one or more loops of conductive material each positioned in a second plane approximately parallel to the first plane.
12. The system of claim 11, wherein the detector comprises multiple loops of conductive material spaced from one another in the second plane.
13. The system of claim 12, wherein a magnetic flux density generated by the power source in a first region of the second plane is larger than a magnetic flux density in a second region of the second plane, and wherein an area of the detector loops is smaller in the first region of the second plane than an area of the detector loops in the second region of the second plane.
14. The system of claim 11, wherein when the auxiliary coil is activated by the control electronics, the auxiliary coil generates a magnetic dipole oriented in a direction perpendicular to the first plane.
15. The system of claim 1, further comprising the power source and the power receiver, wherein the power source comprises a source resonator coil comprising a plurality of loops of conductive material defining a third plane, and wherein the power receiver comprises a receiver resonator coil comprising a plurality of loops of conductive material defining a fourth plane.
16. The system of claim 14, wherein the third and fourth planes are approximately parallel.
17. The system of claim 14, wherein when the power source is activated by the control electronics, a source resonator of the power source generates a magnetic dipole oriented in a direction perpendicular to the third plane.
18. The system of claim 1, wherein the detector is positioned closer to the power source than to the power receiver, and wherein the control electronics are configured so that if debris is positioned in proximity to at least one of the power source and the power receiver, the control electronics at least one of interrupts wireless power transfer between the power source and the power receiver, reduces an energy transfer rate between the power source and the power receiver, and provides a warning indicator to a user of the wireless power transfer system.
19. A method, comprising: 
activating an auxiliary coil, separate from a power source and from a power receiver of a wireless power transfer system, to generate a magnetic field at a position of a detector positioned in proximity to at least one of the power source and the power receiver; 
measuring an electrical signal generated by the detector in response to the magnetic field; and 
determining whether debris is positioned in proximity to at least one of the power source and the power receiver by comparing baseline information to the measured electrical signal, 
wherein the baseline information comprises information about an electrical signal generated by the detector when no debris is positioned in proximity to the power source and the power receiver; and 
wherein comparing the baseline information to the measured signal comprises determining mean and covariance matrices for the baseline information and determining whether debris is positioned in proximity to at least one of the power source and the power receiver based on the mean and covariance matrices."
