Publication Number,Title,Abstract,Claims
US8400017,Wireless energy transfer for computer peripheral applications,"Described herein are improved configurations for wireless power transfer for computer peripherals, including a source magnetic resonator, integrated into a source station and connected to a power source and power and control circuitry; a device magnetic resonator, integrated into a computer peripheral; wherein power is transferred non-radiatively from the source magnetic resonator to the device magnetic resonator, and where the quality factors of the source and device resonators, Qs and Qd, satisfy the relationship, ?{square root over (QsQd)}>100.","What is claimed is: 
1. A wireless power transfer system for computer peripherals, comprising: 
a source magnetic resonator, integrated into a source station and connected to a power source and power and control circuitry; 
a device magnetic resonator, integrated into a computer peripheral; 
at least one additional device magnetic resonator, integrated into at least one additional computer peripheral; 
at least one additional source magnetic resonator integrated into the source station and connected to the power and control circuitry; 
wherein power is transferred non-radiatively from the source magnetic resonator to the device magnetic resonator, and the quality factors of the source and device resonators, Q s and Qd, satisfy the relationship, ?{square root over (QsQd)}>100.
2. The system of claim 1, wherein the at least one computer peripheral is powered directly by the energy transferred to its device magnetic resonator.
3. The system of claim 1, wherein the at least one computer peripheral includes at least one rechargeable battery that is charged by the wireless power transfer system.
4. The system of claim 1, wherein the at least one computer peripheral includes at least one energy storage unit that is energized by the wireless power transfer system.
5. The system of claim 4, wherein the said power transfer is configured to be active when the computer peripherals are not in use.
6. The system of claim 4, wherein the said power transfer is configured to be active when the source station computer is inactive.
7. The system of claim 1, wherein the at least one computer peripheral includes at least one super capacitor that is charged by the wireless power transfer system.
8. The system of claim 1, wherein at least one of the said magnetic resonators is a planar resonator comprising at least one electrical conductor wrapped around a core of magnetic material.
9. The system of clam 1, further comprising at least one passive magnetic resonator used to enhance the power transfer of the system.
10. The system of claim 1, further comprising at least one passive magnetic resonator used to extend the distance of power transfer of the system.
11. The system of claim 1, wherein at least one of the computer peripherals is a computer keyboard.
12. The system of claim 1, wherein at least one of the computer peripherals is a computer mouse.
13. The system of claim 1, wherein the source station is an all-in-one computer.
14. The system of claim 13, wherein the power source of the source power and control circuitry is powered from the USB port of the computer.
15. The system of claim 13, wherein the power source of the source power and control circuitry is powered from an internal connection in the computer.
16. The system of claim 13, further comprising a wireless data communication link between the source and the computer peripherals, wherein power status and control information is transmitted through the said communication link.
17. The system of claim 13, further comprising a means for wireless configuration and monitoring of power levels and active times on the computer.
18. The system of claim 13, wherein the power and control circuitry is integrated into the said computer.
19. The system of claim 18, wherein the said source resonators are attached to the bottom portion of the computer monitor.
20. The system of claim 1, wherein the source station is a computer monitor."
US8441154,Multi-resonator wireless energy transfer for exterior lighting,"A mobile wireless receiver for use with a first electromagnetic resonator coupled to a power supply and a second electromagnetic resonator coupled to at least one of a power supply and the first electromagnetic resonator. The mobile wireless receiver includes a load associated with an outdoor lighting unit that draws energy from the load to power a light source associated with the outdoor lighting unit, and a third electromagnetic resonator configured to be coupled to the load and movable relative to at least one of the first electromagnetic resonator and the second electromagnetic resonator, wherein the third resonator is configured to be wirelessly coupled to at least one of the first electromagnetic resonator and the second electromagnetic resonator to provide resonant, non-radiative wireless power to the third electromagnetic resonator from at least one of the first electromagnetic resonator and the second electromagnetic resonator.","What is claimed is: 
1. A mobile wireless receiver for use with a first electromagnetic resonator coupled to a power supply and a second electromagnetic resonator coupled to at least one of a power supply and the first electromagnetic resonator, the first electromagnetic resonator having a mode with a resonant frequency ?1, an intrinsic loss rate ?1, and a first Q-factor Q1=?1/2?1 and the second electromagnetic resonator having a mode with a resonant frequency ?2, an intrinsic loss rate ?2, and a second Q-factor Q2=?2/2?2, the mobile wireless receiver comprising: 
a load associated with an outdoor lighting unit that draws energy from the load to power a light source associated with the outdoor lighting unit; and 
a third electromagnetic resonator configured to be coupled to the load and movable relative to at least one of the first electromagnetic resonator and the second electromagnetic resonator, the third resonator having a mode with a resonant frequency ? 3, an intrinsic loss rate ?3, and a third Q-factor Q3=?3/2?3,
wherein the third resonator is configured to be wirelessly coupled to at least one of the first electromagnetic resonator and the second electromagnetic resonator to provide resonant, non-radiative wireless power to the third electromagnetic resonator from at least one of the first electromagnetic resonator and the second electromagnetic resonator with a wireless energy transfer rate ?, and 
wherein the square root of the product of Q 3 with at least one of Q1 and Q2 is greater than 100.
2. The wireless receiver of claim 1, wherein the lighting unit is an LED lighting unit.
3. The wireless receiver of claim 1, wherein the lighting unit is an incandescent lighting unit.
4. The wireless receiver of claim 1, wherein the lighting unit is a landscape lighting unit.
5. The wireless receiver of claim 1, wherein the non-radiative wireless power is delivered over a distance greater than the diameter of at least one of the electromagnetic resonators.
6. The wireless receiver of claim 1, wherein the second electromagnetic resonator transfers power originating from the first electromagnetic resonator to the third electromagnetic resonator.
7. The wireless receiver of claim 1, wherein the lighting unit further comprises at least one of a battery and an energy storage unit.
8. The wireless receiver of claim 1, wherein the wireless power at least one of charges a battery and powers the lighting source.
9. The wireless receiver of claim 1, wherein the power supply is tunable.
10. The wireless receiver of claim 1, wherein the power supply is coupled to the first electromagnetic resonator using a wired connection.
11. A power source for wirelessly providing power to a mobile wireless receiver, the power source comprising: 
a power supply configured to be placed remote from an outdoor lighting unit; and 
a first electromagnetic resonator coupled to the power supply and having a mode with a resonant frequency ? 1, an intrinsic loss rate ?1, and a first Q-factor Q1=?1/2?1,
wherein the first electromagnetic resonator is configured to be wirelessly coupled to at least one of a second electromagnetic resonator and a third electromagnetic resonator to provide non-radiative wireless power to at least one of the second electromagnetic resonator and the third electromagnetic resonator, the second electromagnetic resonator having a mode with a resonant frequency ? 2, an intrinsic loss rate ?2, and a second Q-factor Q2=?2/2?2 and the third resonator having a mode with a resonant frequency ?3, an intrinsic loss rate ?3, and a third Q-factor Q3=?3/2?3,
wherein at least one of the second and third electromagnetic resonators is coupled to a load associated with the outdoor lighting unit that draws energy from the load to power a light source associated with the outdoor lighting unit and is moveable relative to the first electromagnetic resonator, 
wherein the square root of the product of Q 1 with at least one of Q2 and Q3 is greater than 100.
12. The power source of claim 11, wherein the lighting unit is an LED lighting unit.
13. The power source of claim 11, wherein the lighting unit is an incandescent lighting unit.
14. The power source of claim 11, wherein the lighting unit is a landscape lighting unit.
15. The power source of claim 11, wherein the non-radiative wireless power is delivered over a distance greater than the diameter of at least one of the electromagnetic resonators.
16. The power source of claim 11, wherein the second electromagnetic resonator transfers power originating from the first electromagnetic resonator to the third electromagnetic resonator.
17. The power source of claim 11, wherein the lighting unit further comprises at least one of a battery and an energy storage unit.
18. The power source of claim 11, wherein the wireless power at least one of charges a battery and powers the lighting source.
19. The power source of claim 11, wherein the power supply is tunable.
20. The power source of claim 11, wherein the power supply is coupled to the first electromagnetic resonator using a wired connection.
21. A mobile wireless power system, comprising: 
a first electromagnetic resonator having a mode with a resonant frequency ? 1, an intrinsic loss rate ?1, and a first Q-factor Q1=?1/2?1;
a second electromagnetic resonator having a mode with a resonant frequency ? 2, an intrinsic loss rate ?2, and a second Q-factor Q2=?2/2?2; and
a third electromagnetic resonator having a mode with a resonant frequency ? 3, an intrinsic loss rate ?3, and a third Q-factor Q3=?3/2?3;
wherein at least one of the electromagnetic resonators is coupled to a power supply and at least one of the electromagnetic resonators is coupled to a load associated with the outdoor lighting unit that draws energy from the load to power a light source associated with an outdoor lighting unit; 
wherein at least two of the electromagnetic resonators are moveable relative to each other while transferring power; and 
wherein the square root of the product of at least two of the respective Q factors is greater than 100. 
22. The wireless power system of claim 21, wherein the lighting unit is an LED lighting unit.
23. The wireless power system of claim 21, wherein the lighting unit is an incandescent lighting unit.
24. The wireless power system of claim 21, wherein the lighting unit is a landscape lighting unit.
25. The wireless power system of claim 21, wherein the non-radiative wireless power is delivered over a distance greater than the diameter of at least one of the electromagnetic resonators.
26. The wireless power system of claim 21, wherein the second electromagnetic resonator transfers power originating from the first electromagnetic resonator to the third electromagnetic resonator.
27. The wireless power system of claim 21, wherein the lighting unit further comprises at least one of a battery and an energy storage unit.
28. The wireless power system of claim 21, wherein the wireless power at least one of charges a battery and powers the lighting source.
29. The wireless power system of claim 21, wherein the power supply is tunable.
30. The wireless power system of claim 21, wherein the power supply is coupled to the first electromagnetic resonator using a wired connection."
US8618696,Wireless energy transfer systems,"A wireless power supply includes a source magnetic resonator, connected to a power source and configured to exchange power wirelessly via a wireless power transfer signal with at least one device magnetic resonator integrated into at least one peripheral component of a computer and a processor configured to adjust the operating point of the wireless power supply wherein power is transferred non-radiatively from the wireless power supply to the at least one device magnetic resonator and wherein the power supply forms a part of the computer.","What is claimed is: 
1. A wireless power supply comprising; 
a source magnetic resonator, connected to a power source and configured to exchange power wirelessly via a wireless power transfer signal with at least one device magnetic resonator integrated into at least one peripheral component of a computer; and 
a processor configured to adjust the operating point of the wireless power supply wherein power is transferred non-radiatively from the wireless power supply to the at least one device magnetic resonator and wherein the power supply forms a part of the computer. 
2. The wireless power supply of claim 1, wherein the processor is configured to adjust a frequency of the wireless power transfer signal.
3. The wireless power supply of claim 1, wherein the processor is configured to adjust an impedance matching network of the wireless power supply.
4. The wireless power supply of claim 1, wherein the processor is configured to adjust a power converter of the wireless power supply.
5. The wireless power supply of claim 1, wherein the processor is configured to adjust an amplifier of the wireless power supply.
6. The wireless power supply of claim 1, wherein the wireless power supply is configured to send wireless control signals to the at least one device resonator.
7. The wireless power supply of claim 1, wherein the wireless power supply is configured to receive wireless signals from the at least one device resonator.
8. The wireless power supply of claim 1, wherein integrated device magnetic resonator comprises power and control circuitry.
9. The wireless power supply of claim 8, wherein the device magnetic resonator power and control circuitry comprises a processor.
10. The wireless power supply of claim 9, wherein the device magnetic resonator processor is configured to provide information to the wireless power supply.
11. The wireless power supply of claim 1, wherein the at least one computer peripheral comprises at least one energy storage unit.
12. The wireless power supply of claim 11, wherein the at least one energy storage unit is a battery.
13. The wireless power supply of claim 11, wherein the at least one energy storage unit is a supercapacitor.
14. The wireless power supply of claim 1, wherein the processor controls a battery charging circuit of at least one computer peripheral.
15. The wireless power supply of claim 1, further comprising at least one repeater resonator.
16. The wireless power supply of claim 15, wherein the at least one device magnetic resonator is configured to operate as a wireless source to at least one other magnetic resonator in an active area.
17. A wirelessly powered computer peripheral, comprising: 
a tunable device magnetic resonator; 
a means for transferring information wirelessly; 
and a means for adjusting a parameter of the tunable device resonator; 
wherein the peripheral is selected from the group consisting of a keyboard, a mouse and a touch surface. 
18. A wirelessly powered computer peripheral, comprising: 
a magnetic resonator, 
wherein the magnetic resonator is configurable to operate as a device resonator for capturing energy and delivering power to the computer peripheral in a first active area and as a repeater resonator for improving energy transfer to another computer peripheral in a second active area. 
19. The computer peripheral from claim 18, wherein the magnetic resonator is configurable to operate simultaneously as a device resonator and a repeater resonator.
20. The computer peripheral from claim 18, wherein the magnetic resonator is periodically switched from a repeater function to an energy capture function.
21. The computer peripheral from claim 18, wherein the peripheral comprises a keyboard.
22. The computer peripheral from claim 18, wherein the peripheral comprises a monitor.
23. The computer peripheral from claim 18, wherein the peripheral comprises a touch screen."
US8629578,Wireless energy transfer systems,"A wireless power transfer system for computer peripherals, includes a source magnetic resonator, integrated into a source station and connected to a power source and power and control circuitry, and a device magnetic resonator, integrated into a computer peripheral wherein power is transferred non-radiatively from the source magnetic resonator to the device magnetic resonator, and wherein the source magnetic resonator is configured to transfer power during predefined intervals.","What is claimed is: 
1. A wireless power transfer system for computer peripherals, comprising: 
a source magnetic resonator, integrated into a source station and connected to a power source and power and control circuitry, and 
a device magnetic resonator, integrated into a computer peripheral; 
wherein power is transferred non-radiatively from the source magnetic resonator to the device magnetic resonator, and wherein the source magnetic resonator is configured to transfer power during predefined intervals. 
2. The system of claim 1, wherein the source magnetic resonator is configured to transfer power when the computer peripheral is not in use.
3. The system of claim 1, wherein the source magnetic resonator is configured to transfer power during predefined times of a day.
4. The system of claim 1, wherein the source magnetic resonator is configured to transfer power when the computer peripheral is within an energy transfer range of the source.
5. The system of claim 1, wherein the device magnetic resonator comprises shielding to reduce a magnetic field interaction with lossy materials forming a part of the peripheral.
6. The system of claim 1, wherein the computer peripheral is powered directly by the energy transferred to the device magnetic resonator.
7. A wirelessly powered computer peripheral, comprising: 
a device magnetic resonator, and 
a repeater resonator, 
wherein the repeater resonator is positioned to enable the coupling to a second computer peripheral. 
8. The peripheral of claim 7, wherein the peripheral is a computer keyboard.
9. The peripheral of claim 8, wherein the second peripheral is a computer mouse and the repeater resonator is positioned to enable the transfer of power to the computer mouse positioned on one side of the keyboard.
10. The peripheral of claim 7, wherein the peripheral is a touch surface.
11. The peripheral of claim 7, wherein the computer peripheral includes at least one rechargeable battery that is charged by a wireless power transfer system.
12. The peripheral of claim 7, wherein the computer peripheral includes at least one energy storage unit that is energized by a wireless power transfer system.
13. The peripheral of claim 7, wherein the computer peripheral includes at least one super capacitor that is charged by a wireless power transfer system.
14. A wirelessly powered computer peripheral, comprising: 
a magnetic resonator, 
wherein the magnetic resonator is configurable to operate as a device resonator for capturing energy and delivering power to the computer peripheral and as a repeater resonator for enabling energy transfer to another computer peripheral from an external wireless energy source. 
15. The computer peripheral of claim 14, wherein the magnetic resonator is configurable to operate simultaneously as a device resonator and a repeater resonator.
16. The computer peripheral of claim 14, wherein the magnetic resonator may be periodically switched from a repeater function to an energy capture function.
17. The computer peripheral of claim 14, wherein the peripheral is a computer keyboard.
18. The computer peripheral of claim 14, wherein the peripheral is a monitor.
19. The computer peripheral of claim 14, wherein the peripheral comprises a touch surface.
20. The computer peripheral of claim 14, wherein the peripheral comprises a light.
21. The computer peripheral of claim 14, wherein the peripheral is at least one of a smart phone, a tablet computer, a game console and a controller.
22. The computer peripheral of claim 14, wherein the peripheral is powered directly by the energy transferred to the device magnetic resonator.
23. The computer peripheral of claim 14, wherein the peripheral comprises at least one rechargeable battery that is charged by a wireless energy source.
24. The computer peripheral of claim 14, wherein the peripheral comprises at least one energy storage unit that is energized by the wireless energy source.
25. The computer peripheral of claim 14, wherein the peripheral includes at least one super capacitor that is charged by the wireless energy source."
